clean_text,sentimen
nih gua kasih tau justru bebal gen boomer dn milenial mreka paling banyak kemakan doktrin sosmed bahkan mreka terangan dukung ruu tni mikir dulu ngetik goblok lu pikir turun jalan kemarin tuh jasa siapa klo bukan gen z,0
kodim sampang bersama komponen masyarakat halal bihalal amp pemahaman ruu tni jadi jembatan harmoni negeri kabupatensampang kodambrw korem kodimsampang tniprima tniad tni,1
kamera siap kalian disana langsung bawa tuh ibu usah nanya pokoknya angkat siap komandan citra baik ruu tni,1
loh lebih penting ruu tni tv one,0
memang bukan voters golput kaga mau melek soal ruu tni anjir,0
kemaren nemu pfpnya suichan sefonk ruu tni its so over,1
framingnya guru gembul ingat gak semua netizen cerdas banyak langsung salah sangka membaca twit publik figur janganlah membiat narasi seakan jurnalis mati karna demo ruu tni,0
ruu tni bukan kekuatan militer kesiapan bangsa menghadapi tantangan zaman tni hadir menjaga indonesia tetap aman era serba digital ruutni tniuntuknegeri,1
tni selalu bersama rakyat ruu tni mempertegas komitmen tni hadir tengah masyarakat menjaga ketahanan nasional mendukung pembangunan bangsa tnikuatrakyatbermartabat ruutni,1
terlihat sebuah cuplikan video menit narasi menampilkan perdebatan hangat najwa shihab presiden prabowo membahas soal ruu tni ruu kepolisian ruu kejaksaan,1
omon omon terus pak ruu tni ruu polri rakyat makin miskin menuju transformasi miskin kebangkrutan,0
memungkinkan cuman kuli indonesia pengesahan ruu tni menangkis percuma kuliah pengesahan ruu tni memungkinkan suntuk optimis,1
coba buktikan dulu selesaikan ruu perampasan aset pemerintah koalisi kim menyegerakan ruu tni kalau mendengar ucapan beliau wawancara terakhir kok ragu beliau mengerahkan energinya ruu perampasab aset ruu tni,0
salam jumat berkah genkz adanya kebijakan dibuat pemerintah dpr ri baru baru makin ruwet gak jelas buru kalo mo efisien cb sahkan uu perampasan aset koruptor bknnya ruu tni amp kejaksaan tolakruukejaksaan cabutuutni hotways jafar hasto chindo,1
demo tolak ruu tni selesai mau wacana ruu polri sekarang nambah wacana jilat pantat as bantu pembersihan etnis gaza,1
prabowo menggunakan klaim trump soal dana usaid ngongo aku meyakini semua narasi masa bayaran hingga draf ruu tni palsu datangnya kepalanya sendiri,0
salah satu parjo nanya ambigu kalian gak demo teman gua tengilnya jawab demo apa pak tolak ruu tni,0
emang nulis bahasa indo baik kaga benar wkwkw mungkin maksudnya begini ikut demo demo ruu tni kuliahnya dapet ipk karna sini kampus gak ikut demo gak penting demo ruu,0
onana kontolak ruu tni kesayangan,0
pak gub dki ksh statement tuh kalo udah tegor kasatpolpp dki nda ngulangi kesalahan timnya mengusir aksi camping menolah uu tni ruu kepolisianjd camping lagiiiihehehe,0
jujur kalau bukan prinsipku ujian jangan nulis kepanjangan aku sekali menulis soal rechstaat ruu tni halaman folio khusus jadinya aku cuma merangkum kezaliman pemerintah frasa autocratic legalism doang huh,0
pov ruu tni polri pas udah sah,1
indonesia kuat bersama rakyat amp tni dukung ruu tni kedaulatan negara kesejahteraan rakyat indonesia,1
akwooka i remember that one tiktok seleb maksa banget pgn dianggap cindo sampe ruu tni kluar kmrn akhirnya dicengin sama cindo asli,0
lumayan wise pas dicecar sama keluarga besar masalah ruu tni polri he didn t take it personally cuma bilang polisi pake seragam mah melawan ketentuan dibuat atas cuma pribadi memang hawatir ngingat jaman orde lama,0
gua bukan menolak segi tempat tinggal oke deh banyak pulau pulau kosong ekonomi terus ruu tni bahkan demo apa pikirin sama presiden sama wapres buka suara kemukakan deh,0
ruu tni mengembalikan dwi fungsi abri bersama dukung tni kuat profesional pertahanankuat dukungruutni tniprofesional indonesiaterang ruutni,1
ruu tni mengembalikan dwi fungsi abri bersama dukung tni kuat profesional pertahanankuat dukungruutni tniprofesional indonesiaterang ruutni,1
ruu tni mengembalikan dwi fungsi abri bersama dukung tni kuat profesional pertahanankuat dukungruutni tniprofesional indonesiaterang ruutni,1
usai ruu tni baru disahkan dpr kini mencuat ruu polri ruu kejaksaan lembaga penegak hukum tngah gencar mlakukn revisi uu utk memperluas kewenangannya ranah hukum tumpang tindih kewenangan jelas mengiringi tupoksi masng² lembaga tokakruukejaksaan,1
mana satpol pp membongkar tenda dipasang massa bagian penolakan ruu tni padahal sebagian pendemo mengaku aksi dilakukan kondusif membuat onar,1
satpol pp minta maaf soal pembongkaran tenda massa aksi tolak ruu tni dpr satuan polisi pamong praja satpol pp dki jakarta menyampaikan permohonan maaf atas kegaduhan terjadi aksi penolakan rancangan undangundang ruu tni depan pintu gerbang pancasila,1
knp dicari tuh keluarga korup tinggal jawa dri pd ngeributin kmntar orng haha otak dipake sekalian klo jago datengin rmh dpr bilang penerapan ruu tni sesuai asas keterbukaan kan situ jawa eksekusi sesama jawa arti merusak moral j,0
diusut ngirim bkn kurirny donggklo smp klean tumbalkan kurir guoblog klo klean bkn ngirim usut tuntastransparan barang bukti amp hasil penyelidikan dibuka gamblangga kaya ruu tni rapat trbatas bukan cm tertutup tbtb diketok hasilny gbs diakses kan bodoh,0
ruu tni bukan ancaman perkuat pertahanan pertahanankuat dukungruutni tniprofesional indonesiaterang ruutni,1
ruu tni mengembalikan dwifungsi abri pertahanankuat dukungruutni tniprofesional indonesiaterang ruutni,1
bps jumlah warga miskin juta jiwa bank dunia jumlah warga miskin juta jiwa drpd ributkan ruu tnipolrijaksa lbh baik pemerintah fokus berantas kemiskinan hingga sita aset koruptor ubah indonesiamakingelap mnjd terang,0
guru pkn gue voters anak kelas gatau ruu tni kesesatan si wowo langsung cuci otaknya sama mengagungkan si wowo banget tu orang,0
tantangan makin kompleks pertahanan tak stagnan ruu tni hadir perkuat sinergi respons cepat tni hadapi ancaman modern indonesia aman terang dukungruutni tniprofesional pertahanankuat indonesiaterang,1
tantangan makin kompleks pertahanan tak stagnan ruu tni hadir perkuat sinergi respons cepat tni hadapi ancaman modern indonesia aman terang dukungruutni tniprofesional pertahanankuat indonesiaterang,1
tantangan makin kompleks pertahanan tak stagnan ruu tni hadir perkuat sinergi respons cepat tni hadapi ancaman modern indonesia aman terang dukungruutni tniprofesional pertahanankuat indonesiaterang,1
masyarakat memang mempercayai tnipolri kalau bekerja baik jangan pernah minta kenaikan pangkat dukungan masyarakat jadi gak mengesahkan ruu tnipolri,1
kelas w bahas ruu tni,1
gampangnya begini rakyat butuh ruu perampasan aset koruptor memulihkan keuangan negara bolongbolong digerogoti koruptor rezim justru memberikan uu tni ruu kejaksaan memperbesar kewenangan aparat konsekuensinya membuat keuangan negara,0
ihh tulisan tolak ruu tni kampus gue hilang cat ulang,0
jurnalis bunu sejak demo ruu tni mngkin kebetulan,1
bansos nya udah bagibagi buat tanda tangan ruu tni,1
nah ruu tni lebih penting dripada isu recehan,1
halah pak pemberantasan korupsi memiskinkannya kok segala dirundingin diskusi mendalam pas pembentukan ruu tni langsung dibuat transparan rakyat manaa pas rapatnya tertutup kapan menyusahkan rakyat cepet gimana dong,0
susp emg angkat buzzer oposisi nganu diup pas isu ruu tni naik makanya gw setuju laporin ngangkat biar muncul,1
pengalihan issue biar rakyat pd was was ttg ruu tni biar ademin suasana bawa lah issue internasional gemar disukai sama indo hihi,1
bodo sama mikirin dulu negara indon pemerintah seenaknya jidat sama regulasi negara malah mau jadi pengalihan issue biar rakyat pd ruu tni,0
isu sampah receh ditengah penolakan ruu tni polri nya ributin isu beginian bukannya satuin suara fokus dlu jelas jelas ancaman didepan mata,0
tolak ruu tni,0
tolak ruu tni,0
giliran begini pakai ritual keagamaan gua tolak ruu tni tetek bengeknya gak usah pake ritual agama dulu dikatain kaum bani apalah ekstrimis lah teroris lah giliran skrg baru pake atribut agama,0
iyaaah wkwkwkwk aku mobil sama sudaraku kelas sd nge bahas jokes roblox tolak ruu tni sama gw kuat mobil isinya keluargaku rata pro si bowo aku denger dalem hati kek nice lanjutkan terusin yapping mu,1
demo tolak ruu tni kemaren lihat dengerin lihat buka matamu tni hadir duta indonesia misi kemanusiaan internasional,1
demo tolak ruu tni kemaren lihat dengerin lihat buka matamu tni hadir duta indonesia misi kemanusiaan internasional,1
demo tolak ruu tni kemaren lihat dengerin lihat buka matamu tni hadir duta indonesia misi kemanusiaan internasional,1
akibat ruu tni,0
goreng terus sampe laku males nyinyirin pribadi org publik gue pantau nih ruu tni polri,0
bokap sekarang dituduh pki ngeedukasi tongkrongannya soal ruu tni,0
semenjak viral post demo dirobloks emang gen a alpha alomani sadar masalah ruu tni sumpah bocah sekarang prefer doktrin alomani tungtung sahur politik praktis bocil didnt give a damn abt parjo holy shit they dumb kalo nyoba doktrin gini aowkwk,0
alihalih mengevakuasi bikin ruu tni mending petinggi tentara dikirim sana bentuk solidaritas dukungan kemerdekaan palestina nganggur ye kan terus masuk jabatan sipil menyebabkan ilmu keterampilan angkat senjata mubazir,0
serius kadang suka pengen bikin thirst trap abis baca berita palestine baca harga dollar baca kbgo femisida ruu tni polisi bunuh sipil malah jadi ngilu sendiri,0
nie pemiliknya rifan hermansyah kemarin ikut kamping sih tolak ruu tni lebih mulia ketimbang elu si daniel kalian tukang tilep donasi aduh aduh aduh,0
ylbhi aksi tolak ruu tni diwarnai kekerasan koalisi sipil luncurkan pusat data kekerasan nasional,1
tuhhh bikin satu partai amp pemilu tanggung ruu tni mah,1
pemred idn times langsung ngomongin supersemar sama ruu tni prabowo langsung bikin prabowo mencakmencak,1
gw upload template story kasus pemerkosaan dokter temen dokter gw reaksinya biasa pas template ruu tni kemaren temen gw polisi tni misuhmisuh,1
waktu masy demo buzzer istana komentarnya seragam jangan hnya demo uu tni demo ruu perampasan aset donk skrg malah ketahuan siapa mnghambat kira narasi tukang cebok apa stlh,0
ternyata oposisi twitter gampang dipecah belah tinggal suruh ae islamophobe ngaduk tai udah lupa ama ruu tni,0
wawancara prabowo hambalang penuh kontroversi demo bayaran ruu tni amp polri hingga komunikasi antikritik bikin publik bingung swipe lihat poinnya share pendapatmu transmediasosial tms prabowo,1
draf misterius disembunyikan dpr ruu tni lalu wakil rakyat mengesahkan uu buat kepentingan siapa dpr mengakomodir suara keluhan rakyat tolakuutni tolakruukejaksaan __ innalillahi gaza ganteng rest in peace ningning,1
pola kekerasan aparat keamanan ditemukan lbhylbhi selama aksi tolakruutni kepolisian melakukan tindakan persekusi penganiayaan penyiksaan penghilangan paksa penangkapan sewenangwenang massa aksi demonstrasi tolak ruu tni,1
grok xai berdasarkan data kepercayaan publik kepolisian indonesia april diperkirakan menurun januari survei indikator kemungkinan akibat protes barubaru terkait ruu tni laporan brutalitas,1
kepala satpol pp jakarta meminta maaf usai anggotanya membubarkan paksa massa aksi tolak ruu tni berkemah depan gedung dpr ri jakarta rabu aksi demonstrasi satpolpp jakarta asumsico,1
menteri sekretaris negara prasetyo hadi menyampaikan kamis april presiden prabowo subianto segera menandatangani draf ruu tni draf disetujui rapat paripurna dpr kini berada meja presiden prasetyo memastikan,1
tadi siang mimpi fotbar sama pa prabowo trs bahas ruu tni,1
presiden ri prabowo subianto menanggapi polemik revisi undangundang tentara nasional indonesia ruu tni dipercepat disahkan jadi uu proses ruu tni menuai banyak penolakan prabowo ruu tni dipercepat suatu fenomena berapa tahun terakhir,1
siapa masalahin org sipil demo kan gw permasalahin orang jadi ikon perempuan melawan org sipil nolak ruu tni caranya benar ngapa lu samain sama bocil tantrum gatau aturan,0
dihapus dunia ruu tni aturan batas umur bekerja aplikasi face app hape kak byeopn,1
wih keren banget lucas bergvall ikutan komentar ruu tni,1
persis sebulan lalu isu ruu tni didengungkan buzzer kebo berharap chaos amp ekonomi stagnan ruu tni lewat ihsg rebound bahay benar buzzer banteng,1
oalah pantes emang salah kalau gw bertanya gw cuma heran awal pilpres malas gw sama sama gak setuju ruu tni coba lo lihat,0
ehhhh kalo kamu gaa keberatan aku suka rt terkait ruu tni berita gonjang ganjong terkini lainnya indonesia ayokk,1
pertanyaan soal kewenangan polisi ruu polri bakal diperbesar ps bilang percaya sama sistem malah balik ngomongin uu tni seolaholah ngasih kode naskah karangan gitu,0
pas ditanya ruu tni bilang cuma soal usia pensiun perlu diperpanjang simpel katanya lebih,1
emng ruu tni jelek apa,0
membedah revisi ruu tni apa perubahan dampaknya revisi ruu tni membawa sejumlah perubahan penting berpotensi mengubah dinamika peran tni indonesia apa poin krusial diatur revisi juristresia uutni jrinfo,1
mbg jd huru rara permainan untungan ruu tni disahkan ruu perampasan aset g disahkan msh bnyk keterbasan g bs sebut satu satu apa smua damai g damai,0
ruu tni nya,1
danai rakyat kerja centengim oligarki prajurit polri adu domba rakyat komandan cuan kepercayaan rakyat institusi rusak ruu tni polri gunakan backup obor china legalkan psn,0
masalahnya disana gada info foto utk dukung ruu tni cuma dipanggil ayo sini foto bareng duh apa dibilang bagus org dikasih diboongin utk apa lucu benar deh masnya buzzernya pinteran dikit mas,1
iyo selaw bro balek lai fokus lawang uu tni skrg lai ruu polri,1
buru buru banget kayak pengesahan ruu tni,0
harapannya uu tni dicabut ruu polri disahkan penuhi semua tuntutan massa aksi indonesia gelap,1
bjir lah lu anak gue banget kak nilai psts science lu masyaallah gue lupain kalau you ngedukung ruu tni kek patah hati miss,0
speak up soal ruu tni kalo salah ingat,1
umum revisi ruu tni jelas mengancam demokrasi khusus mengingatkan petani cengkeh memori suram monopoli cengkeh dilakukan pemerintah era orba melalui badan penyangga pemasaran cengkeh bppc,1
padahal cukup publish lpj hasil donasinya bareng warga kemarin circlenya udah ketahuan nilep duit donasi mana bareng warga akun anonim kalau ketahuan nilep donasi tinggal tutup akun beres btw taggar batalkan ruu tni gak salah ruunya udah jadi uu,0
ditanya jurnalis idn times wawancara hambalang ditanya apa urgensinya ruu tni segera disahkan dpr knp transparansi draft terkait ruu bowo bukannya jawab pertanyaan justru jawabnya mencla mencle amp tunjuk jari dgn mimik muka serem,0
bongkar paksa tenda pengunjuk rasa tolak ruu tni depan dpr satpol pp dki minta maaf atas kegaduhan terjadi,1
usa berfikiran buruk negara chaos cukup buat kebijakan bersinggungan sama rakyat demo pangan harga terjangkau bbm minyak dunia turun diturunkan tolak ruu tni simple kan bilang perlu berhutang jgn hutang prab sendiri ngomong,0
bagaimana cara rakyat kecil mengadu wakilnya ruu perampasan aset uu tni pik skarang uupolri puaskah rkyat kecil monopoli,0
ruu tni sesungguhnya memiliki urgensi mendesak dibahas rangka melakukan transformasi militer arah profesional cabutuutni tolakruukejaksaan gede ppds gaji jt presiden diskon,1
tanggapan temenku diskusi terkait ruu tni berawal mengecam cara pendemo mengekspresikan kemarahannya sama rezim bikin gambar wowok wiwik ciuman,1
wawancara tersebut prabowo tampak kehilangan arah seolaholah kekurangan informasi penting bahkan isu sekrusial ruu tni sedang mengguncang stabilitas sosial,1
coba pak prabowo tanya orang ikut demo pak kl hampir semua setuju ruu tni cacat apa iya pihak ngontrol ide pikiran seluruh masyarakat indonesia seems genuine to me,0
tahukah ruu tni baru disahkan ruu tni pasal uu tni usia pensiun anggota tni tniprima profesional responsif integratif modern adaptif ruutni tniadmengabdidanmembangunbersamarakyat sahabattni,1
pengalihan isu tetap kawal ruu tni ruu polri lainnya,1
mahasiswa stimik tunas bangsa bersama dgn pmii komisariat banjarnegara mem protes uu tni ruu polri ruu kejaksaan mengajak seluruh mahasiswa banjarnegara utk bangkit melakukan upaya menolak uu tersebut batalkanuutni tolakruupolri tolakruukejaksaan,1
kak turun perlu jdi buzzer human punya empati karna pemerintah buruk banget dri ruu tni yanh disahkan transparan buat apa tni dwifungsi tni ditempatkan kementrian lembaga status aktif emg g demo,0
akunnya kak iggy beneran ilank cuma gegara ngetweet banyak buanyak soal tolak ruu tni ancene negara blegedes pokoke terimakasih menemani fangirlingku beberapa bulan terakhir kak moga ketemu keadaan lebih baik ltltlt,1
berikut rangkuman aksi penolakan pengesahan uu tni ruu polri aliansi mahasiswa morowali malam tadi aksi protes berlangsung mulai pukul sore hingga malam depan kantor dprd morowali,1
oot org mengaitkan nikah muda kurang pinter sepupuku anak ui emg pinter banget org nolak ruu tni voter benci prabs anteknya pro palestine kmrn lulus ui summa cum laude nikah umur otw,0
setuju permintaan maaf atas perusakan dilakukan adik menolak ruu tni menolak revisi uu pilkada berktp dki memilih pilgub kemarin semoga pa gub melupakan perjuangan,1
stop jump in isu viral ruu tni jadi ketutup isunya garagara fans lu lo sebutin tuh siapa pernah bermasalah sama lo isu apa pernah lo senggol,0
centra initiative menolak pembahasan rancangan undangundang ruu perubahan atas uu tni uu polri uu kejaksaan centra menyoroti pembahasan ruu memiliki urgensi,1
wawancara dg jurnalis senior hambalang prabowo dinilai memiliki peta jalan jelas utk pemberantasan korupsi prabowo tampak ragu mendukung upaya pemiskinan koruptor melalui pengesahan uu perampasan aset pantes lbh utamakan ruu tni kejaksaan polri,1
berdasarkan wawancara prabowo april hambalang jurnalis senior bukan media disebut tampak menjawab relevan topik ruu tni ekonomi demokrasi dijawab detail sesuai pertanyaan asumsi liar akui kekhawatiran,1
sekarang pahamkan knp ruu perampasan aset kunjung dibahas amp sah kan malah ngebut mengesahkan ruu tni sebentar menyusul ruu kejaksaan ruu polri padahal ketiga ruu urgensinya patut dipertanyakan cabutuutni tolakruukejaksaan boikot ppds,0
civil emergency indonesia gelap tolak ruu tni tolak ruu aneh entahlah mengikuti tagar,1
prabowo bicara mengenai ihsg anjlok ruu tni polri tarif trump amp ketahanan pangan stabilitas harga,1
menyetujui ruu tni ingatan bangsaku pendek,0
demo mau menemui apa sich susahnya temui dong mahasiswa demo tuntutan mahasiswa tangkap adili jokowi batalkan ruu tni pecat wapres gibran,0
miris ruu memikirkan kesejahteraan prajurit kek bintaratamtama notabene tni pensiun jenderal diperpanjang bawahan susah naik pangkat giliran perlawanan sipil pasang badan atasan mah ongkang kaki,0
rill laskar pelangi sih skrg suka banget ngluarin teks berbau politik aoakoaoaka memasak dpr ruu tni,1
btw ruu tni komandan ngejabat jadi mchan dong jadi ceo livium gak,1
kmaren gw hbs instansi nah sebelah gw bpk parjo sambat soal ruu tni soalnya buat petinggi mihak bawah,1
bego lu namanya ruu tni ruu polri otomotis membawa sluruh nama institusinya wajar rakyat tetep mengarah mreka semua makanya kalo mau bikin kebijakan tu jgn mancing kemarahan rakyat,0
sedi banget udah percaya _ sempet bingung pas rame protes ruu tni polri akunnya malah post minta donasi terusan ternyata kayaknya emang indikasi ngaco _,0
si dontol jd presiden malah nyetujuin ruu tni emang dongo kontol,0
padahal bayar orang buat pegang spanduk dukung ruu tni ditanya alasannya jawab siapa,0
aku rewatch aku inget banget dlu pas omnibus law nu mengkritik kepemimpinan prof said aqil eh nu sekarang malah senyap pas ruu tni tambang malah dpt bagian kritik blass ternyata aku tau alasannya vidio knp nu skrg diam,0
grgr sempet heboh pas ruu tni tkt disalahgunakan data pribadinya was reda skrng,1
bagaimana pendapat mahasiswa mengenai ruu tni berdasarkan tayangan youtube najwa shihab presiden prabowo,1
maret ribut pilpres kasus singgih sahara april ribut ruu tni prabs yapping unfaedah kasus donasi rumahliterasi,1
semoga indonesia udah recovery ruu tni dah dihapuskan supremasisipil batalkanruutni,1
eh deh uu perampasan aset mending keluarin dulu tuntutan celaka banget anjir kalo tebang pilih amit malah disahin lebih urgent kayak ruu tni sama polri sama kuhp dibiarin nnti alesanny lah kan kalian nuntut uu perampasan aset diturutin,0
satpam kepala satpam kalau kepala satpam sekarang tau kan feminis suka ama ruu tni baru,0
gitu yaskalian uji mental batalkan ruu tni supremasisipil civilphobia cabutuutni,1
gercep benar dah kayak pemerentah ngesahin ruu tni,0
berkelas banget inisippsipp batalkan ruu tni supremasisipil civilphobia cabutuutni,0
byk supportyakinayolahgassbatalkan ruu tni supremasisipil civilphobia cabutuutni,1
sedang merayakan disahkan nya ruu tni,1
kalian bisaayoayoayo batalkan ruu tni supremasisipil civilphobia cabutuutni,1
kemarin tgll april diskusi prabowo diwakili sumi dasco kemungkinan banyak pertanyaan soal indonesia gelap amp demonya jadi penolakan uu tni jelas rakyat menolak dwi fungsi tni amp ruu mau disahkan transparan kpd rakyat termasuk,0
ruu tni disahkan memang dibahas wawancara prabowo april hambalang fokusnya kenaikan usia pensiun tni atasi tantangan organisasi menjawab kekhawatiran publik soal pengaruh,1
ruu tni disahkan dibahas,1
lahkok bikin pengin ikut batalkan ruu tni supremasisipil civilphobia cabutuutni,0
pakpakkalo begini dolar jadi naek hadeuwhbatalkan ruu tni supremasisipil civilphobia cabutuutni,1
aku lihat mulai benturan contohnya nasdem terangan lewat metrotv berani kritik prabowo ruu tni swbenarnya mrk gak kompak nyatanya beberapa point tni masuk kementrian diakomodir,1
bersama bisaaura kesolidan makin terasabatalkan ruu tni supremasisipil civilphobia cabutuutni,1
intinyadeh kan daney tuh orang ikutan demo ruu tni dikenal make up longlasting wawancara sama komunitas barengwarga tibatiba call out sama akun anon kalo daney dicari sama korban harrasment si daney,0
hmmmhasil perenungan tenda batalkan ruu tni supremasisipil civilphobia cabutuutni,1
punya ide bginian siapa sich keren tauubatalkan ruu tni cabutuutni supremasisipil,1
tak lelah bersuarabatalkan ruu tni tolakruutni supremasisipil,0
kemarin upload tolak ruu tni tunanganmu loh parjo halah fomo tok,1
makin assiikk nich demo batalkan ruu tni tolakruutni supremasisipil,1
tetap dukungbatalkan ruu tni sepertinya mulai kepanasan niech tolakruutni supremasisipil,0
dihhh kasihin video mendukung ruu tni disuruh ttd banner trs dikasih sembako plis,1
terangterangan dibayar justru demo dukung ruu tni dibanyak tempat contoh gedung dpr jakbar bagibagi bingkisan wajib tandatangan babinsa memaksa warga mendeklarasikan dukungan membentang spanduk jadi siapa dibayar,1
babang jae mah speak up isu gaza sampe isu pemerintah vs rakyat indonesia terutama sekarang ruu tni sampe gue lupa kalau jae orang korea us gimana makin ngestan gue sama gue myday,0
undur diri apaan ngetik tolak ruu tni gak pernah berasa jadi bagian perjuangan cuih lu tuh parasite sistem demokrasi,0
pantes mandek ruu perampasan aset beda sama ruu tni beliau inisiatornya jadi gercep,0
gak tau lah ruu tni jelas proses pembahasan dilakukan tertutup tempat mewah mengutamakan transparansi efisiensi malah mengaitkan komandan lama pensiun masalah utama ketidakjelasan ruu tni baru siapa menunggangi,0
nego apaan opsinya cm mau bongkar sendiri dibantu petugas silahkan pilih malah mau ketemu pimpinan pamdal satpol gada urusan sama pamdal supremasi sipil ruu tni donasi cm menegakkan perda ketertiban umum salah satunya soal fungsi trotoar,1
lu gapernah nyuarain ruu tni gausah bacot memecah belah dah kentara buzzer peraknya,0
ruu kejaksaan ancaman demokrasi tolakruukejaksaanppds mega tni angkatan udara gaji jt jumbo ishg,1
didirikan senin tenda bentuk aksi protes uu tni ruu polri ruu penyiaran digusur satpol pp rabu narasi daily,1
dosen minta tulis speech writing tema nya ruu tni,1
perbedaan ekspresi prabowo ngomongin ruu tni ruu polri beda beda a thread,1
ngapain gue revisi tugas gue kalau ruu tni kaga direvisi revisiuutni tolakruutni,0
td gw iseng stalk akunnya bionya being silent majority satupun tweet tntg nolak ruu tni wkwkw,0
julius ibrani ketua umum pbhi disahkan uu tni dibahasnya ruu kejaksaan fix negara menjadi negara militeristik cabutuutni tolakruukejaksaan,1
demo aksi sipil skala besar lu bubarin power segitu besarnya demo camping literal damai tetep dibubarin sih segitunya belain ruu tni tujuan elo pertahanin apa pak katanya elo dipihak sipil kok civilphobia,0
biar gampang ngincernya kan udah jurnalis tewas sejak ramai ruu tni loh,0
broooo list ikut lolosin ruu tni merugikan rakyat wth are you talking of,0
lbi supin laut bercerita ruu tni seneng deh kl soalnya gini jd gaperlu baca teks wkwkwkwk,1
soal ruu tni cuma fokus soal masa pensiun presiden ps menjawab normatif soal prosesnya solutif terlalu cepat tensi soal mulai meninggi kebijakan usa amp efisiensi anggaran ditanyakan presiden ps lebih menekankan soal kemandirian bangsa,1
dialog terbuka jam lebih lebih seru tempo ikut feed back terlepas jurnalis tsb kritis soal mbg amp gaya komunikasi kurang pembantunya presiden ps mengakui tepat amp perlu evaluasi soal ruu tni,1
sipil sangat membuka diskusi perbedaan pendapat alesan terciptanya ruu tni sangat masuk akal prabowo lebih mudah mengatur memerintah orang militer,1
lah wo bayar kan orang lu tiba kerumunan mendukung ruu tni makanan berapa rate per aksi nya k k,0
kancaku stupid kekeh argumennya emang kebijakan pak prabowo apa sih benerbener bawa dampak negatif kek ruu tni apa coba dampak negatif rl nya kan aneh emg orangorang walah matane picek,0
omon omon ruu perampasan aset dulu disahkan masa kala urgensinya sama ruu ikn ruu tni ruu polri,1
kalian bikin ricuh politik indonesia bikij masalah sosial baru tolol anjir kemarin masalah ruu tni disahkan setolol mungkin kalian gak sadar pengalihan isu prabowo mengesahkan hukuman mati buat koruptor kalian kepancing anjir sama koruptor,0
