clean_text,sentimen
tadi malem ngobrol sama punya warnet ngebahas prabowo lalu bilang kaya gini prabowo teken ruu tni cepetcepet punya temen pemerintahan udah ancur jadi presiden makanya mau sikat sipil pake ruu tni,0
diamdiam ruu tni udah diteken wowo lebaran,1
ruu tni mempertahankan melindungi memelihara keutuhan kedaulatan negara,1
preman jadikan angkatan lebih soft benturkan rakyat sipil kasihan banser ansor jadikan tumbal sekarang ganti grib ruu tni polri kejaksaan fokus memuluskan program obor china legalkan psn hidup jokowi hidup oligarki hajar rakyat,0
ferry cabut terkait ruu tni lha ngapain buzzerp nimbrung situ tolol,0
ditempat kantor polisi aman lagijadi rakyat berlindung kejahatan rasa sepantasnya ruu tni disahkan,1
semakin curiga demo demo anti ruu tni eelama komando geng oslo,0
sepertinya pemerintah memang punya skala prioritas masalah urgent mendesak ruu perampasan aset koruptor didahulukan justru ruu tni polri kejaksaan diutamakan tujuan,1
dampak ruu tni polri kejaksaan ruu semakin garcep rezim zalim membungkam membendung aspirasi rakyat bertentangan kebijakan rezim boneka obor china,1
kewenangan penuh ruu tni polri kejaksaan melegalkan obor china lebel psn anak bangsa adu domba oligarki ongkang kaki rampok sda wilayah,0
padahal gue bangga loh kemarin sama dpr kalteng gegara mau dengerin suara rakyat pas ruu tni kemarin eehhh tb tb gubernurnya kek begini,0
galerifoto perempuan lantang menolak uu tni ruu polri adadikompas,1
perempuan lantang menolak uu tni ruu polri foto adadikompas,1
emang bem berguna jangan kan masalah masalah lebih besar ruu tni diam cupuuuu tuh sekarang,0
klo emg benar jgn kaget gais klo nnti wapres nya militer ruu tni sah selamat menerapkan multifungsi menjabat,1
kantor berita asal prancis menyoroti dwifungsi tni era pemerintahan prabowo akibat pengesahan ruu tni memperluas keterlibatan militer jabatan sipil menjadi jabatan sipil langkah dinilai sbg upaya membuka kotak pandora paus fransiskus aneh banget jago,1
sejak kapan penyampaian pendapat batas waktu kan dpr tiap bikin rapat sering tengah malem sbg contoh ruu tni amp omnibus law urgensi tuh sampe malem rakyatnya ngerasa urgensi mendesak sampe malem terlalu timpang ah,0
batuul pilihannya cuma hapur ruu tni ato buatkan uu buar sipil bersenjata,1
ruu tni lho dihindari investor potensi negara militer usaha bs macet,0
bonus demografi tai ledig memang anak mudanya dikasih kerjaan kok kerja gimana mau kerja investornya dibuat kabur semua becus benahi birokrasi lsm preman ruu tni ri udah jauh kalah sama vietnam,0
ruu tni nongol ruu perampasan aset nongol mahkamah konsitusi diacak nongol perkara receh rame nongol,1
penjelasan gak jelas kayak soal ruu tni disahin tetep gak diupload konyol banget,0
gua kesel banget sama aparat kemarin oknum tni serangbanten diduga menganiaya seorang warga hingga tews kalian percaya sama kacang ijo makin semenamena bertindak disahkan nya ruu tni kemarin,0
teruslah bohong hingga bibir kalian ndower revisi uu tni urgensinya kalian selesaikansementara ruu penyitaan asset urgenitasnya high grade kalian buang tong sampah rakyat tau dpr resmi menolak perppu dijadikan uu,0
ujar wowok ruu tni ttd,1
baca tengah berita kekerasan polisi tentara ruu tni disahkan diam ruuruu pengontrol kekuasaan lainnya dibahas senyap diperparah presiden lulusan militer tuli suara rakyatnya,0
marahinnn banggg fansnya buna tedi pembela ruu tni dukung jokowi periode,0
eng ing eng segera mnyusul ruu sama dgn ruu tni urgent penting untk revisi mending sahkan uu prampasan aset sepertinya jauh lbh brmanfaat kebanding ruu kejaksaan amp polri batalkanruutni tolakruukejaksaan new tour happy easter rest in love,1
pergerakan pikiran iq petisi guru besar pencalonan wapres buzzer said alah bayaran cuma teori pak mahfud sedikit mendukung ruu tni buzzer said pak mahfud tuh guru besar jadi dipercaya klian sp pak mahfud bicara ijaza palsu buzzer said kok gak dulu gtw malu,0
liat bakal jilat ludah sendiri enggak kemarin teriak jangan mau ditunggangi asing waktu banyak demo soal ruu tni kalo nunduk sama trump gpn sama qris dibatasi fix wowo sebenarnya antek asing,0
benar menghianati mimpi besar reformasi kemarin uu tni skrng mrk mensahkan ruu kuhap amp ruu kejaksaan mrk menghianati reformasi terangan amp rasa malu,0
hmm sebuah tekateki politik menarik bukan selami mata jeli saminudin dokumen akademisnya penuh tanda tanya memang mengundang keributan sengaja dipakai mengalihkan isu ruu tni polri aku mengamati,0
semacam kisi ruu polri uu tni yah,1
bagaimana menurutmu hubungan spesifik masalah pengalihan isu ruu tni amp polri,1
jaman tolak ruu tni beb keknya ntr aku mau ngadain lgi sblm opcom,1
makin makin jkt dicoret konser kpop gara² ruu tni semua ngrasa aman ketambahan promotor nya kek gini,0
januari kaga abis abisnya melawan ruu tni sampe lawan promotor allah,0
mana matahari diem ttd ruu tni,1
klo pake alasan ruu tni mah khas orang sok keminter x pake opini trus kasih data mendukung sama sekali orang banyak malas baca jadi manut wae ujungnua disclaimer mau debat kusir,0
banyak tour kpop indo nya skip by dampak disahkan ruu tni kemarin mau invest kaga jadi monyet emg,1
bukan pas ruu tni sahkan bukan sih soalnya pas ruu tni sahkan kmren banyak huru hara sama anak² kpop bilang konser kpop indo bakalan ngak sebebas dulu,0
kalau alasannya ruu tni disahkan cuma investasi baterai jadi,0
skrg tni masuk kampus besok parcok semua d bungkam kekuasaan lergi dgn kritikan sejak d syahkan ruu tni jd begini dah mencak d tempat bukan wewenangnya,0
sori nih bro draft ruu tni muncul situs resmi dprri gimana tau isi pembahasan ruu tni kalau draft terbentuk demo kemarin diviralin pure buat menggulirkan pemerintahan bukan buat menolak ruu tni karna sakit hati,0
aje ngomongin menang kalah udah basi ruu tni lolos kebijakan gak pro rakyat lainnya lebih mengkhawatirkan otak lu gak bakal nyampe sih,0
kira gagasan mahasiswa terima liat pembahasan ruu tni kemarin,1
kalo dah turun tni langsung ambil alih jabatan kan ruu tni dah aktif bang,1
salah kalau kemarin batal invest disini akhirnya keliatan bobroknya paling kasian hyundai udah terlanjut invest besaebesaran mau angkat kaki ruginya ketulungan ruu tni kepentingan pribadi dampaknya berujung keseluruh negeri,0
apapun alasannya kejadian tentara mendatangi aktivis penentang revisi uu tni salah perlu dikecam berulang tekanan sebenarnya bukan baru mengalami serupa imparsial mengkritisi ruu tni ujung berakhirnya,0
ceritanya aku ngebahas ruu tni udah disahkan salah satu temanku nyeletuk gak papa sih semisalnya tni mau kerja apapun mau diluar kerjaan jadi tni karna berjasa udah banyak pengorbanan aku langsung blg gak usah dilanjutin,1
rill allah kemaren waktu angetnya ruu tni gw pusing banget sama bab analisis data revisi terus menerus kayak allah pusing ama negara ditambah pusing ama tugas akhir alhamdulillah udah beres huhu,0
halah kan dpr menggebu secepat kilat resmikan ruu tni jdi kan udah tau effek nya,1
pengesahan ruu tni retaknya prinsip negara hukum,1
unjuk rasa damai dukung ruu tni alunalun mojokerto tempat sama komandan korem cpyj kolonel inf batara alex bulo s hub int m hub int menyambut aksi damai orasi prabu satu nasional terkait ruu tni depan makorem cpyj,1
idk gini pasca sahnya ruu tni kilat coba rekap deh berapa banyak pembungkaman penggusuran dilakuin pemerintah sipil sadar beneran refleksi soalnya baru ruu tni doang udah sangat civilphobia lho aksi sedamai apapun digusur ama,0
tuh bodo apaa bloon si anjingg efel ruu tni kokk gaada positif²nyaa anjingggg,0
ruu tni disahkan kini ruu polri ruu kejaksaan sepertinya disahkan apa sepertinya berlomba lomba menambah kewenangan minim pengawasan cabutuutni tolakruupolri tolakruukejaksaan,1
pantes gerbang depan tulisan tolak ruu tni,1
tni dah kek gibran dicarikan kerjaan sama prabowo lewat ruu tni,1
iyaiya lah sapa mau negara ruu tni nya,1
yeh inimah cuma nguntungin tni hahaha gaada hapus ruu tni,0
klo surat benar dy da nyinggung soal ruu tni,1
gw speechless seimpactful ruu tni,1
akun lama gw blok pas bikin konten demo ruu tni,1
tuntutan da nyinggung soal ruu tni mo ngelepas nguntungin mreka apa usaha purnawirawan utk menggali dukungan rakyat thd tni alias melegitimasi ruu tni gibran emg pantes jadi wapres jadi pns biasa pantes,1
gw mau percaya yakali ruu tni cuman kepengennya mau nyari lebih,0
inikah tujuan prabowo kekeh sama ruu tni mau lepasin beban keknya,0
dukung ruu tni memperkuat sistem pertahanan nasional,1
revisi ruu tni langkah strategis memperkuat profesionalisme,1
ruu tni membawa perubahan signifikan pertahanan nasional semoga semakin memperkuat profesionalisme tni,1
ruu tni membawa perubahan signifikan pertahanan nasional semoga semakin memperkuat profesionalisme tni,1
ruu tni membawa perubahan signifikan pertahanan nasional semoga semakin memperkuat profesionalisme tni,1
makanya kalo bilang ruu tni masalah malahan support liat tuh jawaban tuh ruu diprotes buat batalin,0
plan bail out jauh ruu tni,1
aku udah naruh link berita postingan kedua padahal beritanya pake bahasa korea mungkin orang malas translate aku kasih skrinsutnya baterai lithium ferrophosphate lfp is another supporting factor alasan ruu tni disahkan menegasikan jadi,1
presiden prabowo pemerintah skrg menculik demonstran dalih omsp menggunakan ruu tni baru,1
berita tkdn mau dihapus lah masa ruu tni apa hubungannya,0
terlalu mencampuri apaan kontol emang gen z udah jadi pengambil kebijakan elu liat demo ruu tni seberapa keras demo tetep disahkan sama presiden notabene bukan genz kalo ngetik dipikir dulu lah bodoh,0
justru masalah remeh temeh akar bnyk masalah pagar laut judol ruu polri ruu tni korupsi besar²an,0
ruu tni ruu polri ruu ormas,1
tikar pikiran pengesahan ruu tni,1
percaya jenderal aneh lupa sama ruu tni,0
indonesia justru mengalami masa keemasan industrialisasi pemerintahan soeharto diktator militer ruu tni skg gak apanya dibanding praktik dwifungsi sebuah concern kurang relevan,1
kelompok pensiunan tni tak thu terima kasih dikasih paha minta jantung tak peduli kali pemerintah mengolkan ruu tni menghadapi banyak penentang tantang an,0
apa efek ruu tni disahkan,0
yaudah sih usah dibahas orang bahas ruu tni orang bahas lisa mariana besar terus angin hujan orang antah berantah share foto ijazah akhir makin rame dibahas nutup berita mana dibilang menjabat y g buktinya ngurus polisi,0
mau lah aku punya pasangan nnti diajak bahas random sampe bahas bola sama pemerintah kacau balau masa aku kenalan sama orng bahas public service sama pramuniaga g tau niatnya mau bahas ruu tni pdhl awokekwkwkwk deng,0
salah satu contoh ruu tni sekarang udah jadi uu harusnya ditolak sesimpel cari alasan baik n diterima masyarakat lho gitu kok mau jabatan sipil,0
nah gw perkirakan kalau ruu sangat jauh lebih berbahaya ruu tnijudulnya demokrasi faktanya jd sistim pemerintahan otokratis,0
ternyata hidup emang setibatiba anjir tibatiba ruu tni sah tibatiba gua diselingkuhin sekian kalinya akhh mantap,1
list alasan pwr dinotice ibu nyekel spanduk dukung ruu tni pasar kentu new dawet jembut kecabut,1
ahhh gw pernah debat sama orang tiktok perkara ruu tni bilang ruunya salah orangnya gw baru paham ternyata kesamaan sama sama munafik denial,0
cobain dirumah rebahan hafalin ruu tni bg,1
jadi uu tni ruu polri menjegal prabowo suatu,1
kemaren uu tni skrng mrk kebut ruu kuhap ruu kejaksaan amp ruu polri bukan merusak demokrasi benar menghianati mimpi reformasi,0
kepikiran bias gue ttp ngonser sini egk yah gegara ruu tni disahkan gue hopeless,0
sy perlu mendukung akuntabilitas pemerintah contohnya penetapan ruu tni tergesa bumble date ahhh gak apa kan ngaruh kamu lagian bagus militer sipil biar tegas gak korup,1
dibanding soal promotor kondisi negara lebih memungkinkan mampir kacau banget uu tni udah sah ruu polri ruu kuhap ruu penyiaran kurs semakin naik pemerintah menyepelekan,0
ruu tni aj kk diapus sikap,1
pendukung cebong mana suaranyaaaaaa gayangkoruptor bikin kemah dpr smpai mbuleeettt sama ruu tni bayaran nutupi kasus korupsi nihhhh periksakaesang periksajokowi,0
ruu kuhap ruu tni ruu polres fuck jejak digital kalian bahkan gabisa bedakan mana baik mana buruk bahkan kalau kalian dibilang anjing sebuah penghinaan kaum anjing monyet babi,0
mamah aku dikatain punya pemikiran dangkal tolak ruu tni,0
that one girl sejak pemilu remehin ruu tni sampe tugas mkwu masi bela pemerintah wkwk shame on you,1
gamau jd pesimis person persijen nya ruu tni bs liat si depe r nya teamed up sama pemrentahan satupun oposisi nentang berharap benar keajaiban ntar dtg mana bs mengakhiri masa kegelapan,0
satu kalimat lucu pemerintah gak malu apa sama dokternya padahal tau pemerintah sibuk ngurus danantara ruu tni impor beras minyak jadi buat rakyat mandiri yah,0
susah semua dpr menolak lebih penting ruu tni polri,0
merdeka banget bji heejake menolak ruu tni mah enhypen vamps up coachella enchella enhypen coachella,1
masalah remeh temeh kayak gini terus jadi trending padahal banyak masalah jauhjauh lebih penting pagar laut judol ruu polri ruu tni korupsi besar²an pengalihan isunya,0
ruu tetap mengedepankan supremasi sipil peran tni jabatan sipil diatur diawasi ketat bukan dibayangkan pihak menolak membaca keseluruhan isi revisi tni,1
bilang kawal serius ruu tni dah didemo abis abisan disahkan gaperlu deh dikawal ujung ujungnya jadi sebobrok apapun ruu buatan pemerintah tunggu si dedi mulyadi benerin indonesia moga jadi presiden g melempem,0
lucunya rakyat dicekoki pertunjukkan demo anti ruu tni,0
tar bakal muncul soalnya ruu tni resmi disahin,1
presiden prabowo subianto resmi mengesahkan menandatangani revisi undangundang tni ruu tni menjadi undangundang penandatanganan dilakukan dpr mengesahkan ruu tni rapat paripurna dpr kamis lalu disahkan lebaran,1
lagian ngapain anti sama ruu tni wong dah jelas tupoksinya kok knp anti ruu tni ruu polri g da protesin,0
nahh makin gila emang kelakuan ruu tni nya udah sah,0
bukti tuh nyimak kalo ruu tni kemaren emg pure tone deaf wkwk,0
disahkan nya ruu tni target berikutnya disahkan ruu kejaksaan polri kuhap haruskah diam lovestory wrestlemania pengepungan bukit duri liverpool fourth,1
kegaduhan gunakan rezim boneka china pemilu formalitas faktanya tetap jokowi periode sutradara majikan china misi visi obor china legalkan psn back up ruu tni polri kejaksaan,1
udah tuh ruu tni,0
disinkronisasi pilar uu tni disahkan lanjut ruu polri ruu kejaksaan semua hambatan ancaman menjelang dicegah dilibas sesuai kewenangan diperluas diperkuat ketiga uu tersebut,1
gw ngerti skrng wowo maksa ruu tni,1
dukung pengesahan ruu tni,1
lu kocak kepikiran macam uu tni ruu polri ruu kuhap digas cuma gini doang mah sepele buat presiden pilihan lu ngotot mau negosiasi sama trump,0
bahas pengesahan ruu tni mengancam kekuasaan,1
uu tni ruu polri ruu kejaksaan satu paket warisan mulyono disahkan ketiganya suksesi bapaknya fufufafa lancar hambatan dicegah dilibas cepat sesuai kewenangan aparat makin luas kuat dam ketiga uu tersebut,1
selamat menikmati hidup penuh sengsara wahai rakyat kecil ruu tni polri muktamat sahkan,0
kalau diganti palingan penggantinya militer kan ruu tni udah disahkan,1
satu langkah maju menuju pertahanan nasional kuat dukung ruu tni sistem lebih profesional tengah tantangan global uutni dukunguutni supremasisipil,1
satu langkah maju menuju pertahanan nasional kuat dukung ruu tni sistem lebih profesional tengah tantangan global uutni dukunguutni supremasisipil,1
habis hangout bareng circle ignorant sama masalah ruu tni bodo isu sosial bahkan jelekjelekin orang bersuara benar ngebuat tenaga gue habis bikin badmood pas tadi main anjirlah kesellll pdahal udah sahabatan smp huffttt,0
revisi ruu tni langkah strategis memperkuat profesionalisme uutni dukunguutni supremasisipil,1
dukung ruu tni uutni dukunguutni supremasisipil,1
revisi ruu tni langkah strategis memperkuat profesionalisme uutni dukunguutni supremasisipil,1
ruu tni disahkan mantap kali memang oke gas pilihannya,1
dukung ruu tni uutni dukunguutni supremasisipil,1
ruu tni perjelas peran aparat tni pertahanan negara uutni dukunguutni supremasisipil,1
rakyat indonesia mendukung penuh ruu tni uutni dukunguutni supremasisipil,1
ruu tni semakin perkuat peran tni pertahanan negara uutni dukunguutni supremasisipil,1
mendukung ruu tni uutni dukunguutni supremasisipil,1
profesionalisme aparat meningkat adanya ruu tni uutni dukunguutni supremasisipil,1
intinya paham kan apa korelasi ruu tni pelaku korupsi kan punya pendapat berdasarkn apa ketahui menjustifikasi pendapat orang sendiri kritisi apa maksutnya betul apa betoel,0
oot ni akun pernah gw dm terkait ruu tni gak dibales gak pernah dibahas akunnya alfatihah buat korban buat tni semoga lu mampus penjara,0
tni meningkatkan kemampuan biar rakyat aman dunia maya ruu tni segera disahkan,1
zaman serba digital pertahanan indonesia wajib siap hadapi ancaman siber mampu menghadapi perang teknologi biar tni makin jaya dukung ruu tni,1
betul makanya ruu tni melindungi prabowo subianto kudeta terangterangan jokowi,1
sahkan ruu tni mengimbangi kekuatan jokowi kepolisian,1
kalau prabowo gak mau berhentikan ruu tni tragedi mei bakal terulang,0
ruu tni disahkan tarif us indonesia jadi,1
zaman sekarang tni berbenah hadapi dinamika geopolitik internasional jangan tunda ruu tni,1
faktanya tni berbenah biar tertinggal negara dukung ruu tni,0
dukung ruu tni uutni dukunguutni supremasisipil,1
ruu tni revisi uu no tahun tni disahkan maret uu mengatur peran tugas struktur tni perubahan utama meliputi tni bawah presiden operasi militer strategi bawah kemenhan tugas baru hadapi ancaman siber lindungi,1
abad gini tni butuh upgrade tangguh perang modern makanya ruu tni disahkan,1
apa ruu tni,0
realitanya militer indonesia wajib adaptasi perkembangan zaman keutuhan nkri dukung ruu tni sekarang,1
ancaman siber merajalela tentara perlu beradaptasi indonesia aman serangan siber gaspol dukung ruu tni,1
realitanya tni wajib siap hadapi ancaman siber biar indonesia diremehkan ruu tni bikin tni makin kuat,1
geopolitik memanas tni meningkatkan kemampuan bangsa siap hadapi ancaman apapun ruu tni bikin tni makin kuat,1
geopolitik memanas tni wajib siap hadapi ancaman siber keselamatan rakyat ruu tni tni kuat rakyat aman,1
melihat situasi sekarang alutsista prajurit beradaptasi biar melawan kejahatan siber fix ruu tni didukung,1
dunia modern sekarang kekuatan tni perlu dibekali teknologi baru bangsa siap hadapi ancaman apapun jangan ragu dukung ruu tni,1
abad gini tni perlu upgrade indonesia aman serangan siber semoga ruu tni cepat disahkan,1
era siber tni perlu beradaptasi menjawab tantangan global makanya dukung ruu tni,1
sekarang angkatan bersenjata berbenah biar melawan kejahatan siber saatnya dukung ruu tni,1
melihat kondisi global angkatan bersenjata melakukan modernisasi ruu tni bikin tni makin kuat,1
gibran mmg bermasalah prabowo sangat bermasalah kebijakan blunder macam mbg ruu tni food estate belanja alutsista mendatangkan pengungsi palestina jalankan mata telinga kenekatan bakal menghancurkan republik klo ganti paket,0
senang pak mengsahkan ruu tnilihat nih pak rakyatnya jadi korban kekerasan meskipun bukan penjahat oup lupa pak lebih kasihan sama anak koruptor sama rakyatnya,0
dipungkiri militer indonesia perlu dukungan rakyat jangan ragu dukung ruu tni,1
ancaman siber merajalela tentara perlu reformasi mampu menghadapi perang teknologi ruu tni solusi,1
kok sih kaya gini pantau orang ruu tni kemaren kawal terus,0
ruu tni bukanlah ancaman harapan akab hadirnya harapan pertahanan negara lebih modern responsif profesional,1
ruu tni bertujuan menyesuaikan tugas tni kebutuhan strategis pertahanan nasional menghadapi dinamika pertahanan modern zaman,1
tu komeng masuk kampus knp dema menelusup auditorium dgn membawa mmt bertuliskan tolak ruu tni,1
bicara ruu tni uas rakyat memilih anggota dewan perwakilan keputusan bersama,1
ah kaya paling tau sikon korban mau nunggangin isu apa nebeng isu ruu tni massa ngawal kasus demo offline online kalah malah menelan banyak korban jelas keadilannya,1
ternyata maksud ruu tni biar menciptakan ketakutan masyarakat diusut,0
pembahasan pengesahan ruu tni dilakukan melalui mekanisme resmi sah terbuka langkah bukan soal kekuasaan tpi bagian dri upaya reformasi sektor pertahanan tni dpt berperan lebih adaptif sesuai kebutuhan zaman tetap profesional tunduk supremasi sipil,1
kasihan banser ganti grib benturkan ormas rezim rakyat cara aman bentuk pasukan sipil benturkan sipil back up aparat hidup jokowi ruu tni polri amp kejaksaan obor china legalkan psn sutradara oligarki mahasiswa tangkap aparat tak berdaya hajar,0
ruu tni sedang bekerja baik,1
ngaduk sampe kerak bang jilatin tuh tai kemarin ruu tni bela sekarang mbg lusa ruu polri,0
ribet ngurusin ijazah jokowi ruu tni noh udah ttd asw,0
padahal ditolak ruu tni berhasil ketolak ruu mq,0
bilang pikiran orang kampungan mengkritik kebijakan ruu tni kan bang,0
mohon izin komandan konsolidasi nasional terkait ruu tni dimulai silakan bapak kolonel merapat pusgiwa ui siap bang komandan gerakan ui,1
trlalu memaksa sedang mencitrakan diri intinya rakyat amp mahasiswa tetap menolak soal ruu tni kalian malah bermain dgn api,0
ruu tni bukanlah ancaman harapan akab hadirnya harapan pertahanan negara lebih modern responsif professional,1
ngapa jadi bahas wibu vs kpopers ojol vs cust kb vs vasektomi sih woi ruu tni udah disahin anj,1
dukung ruu tni cekfakta uutni dukunguutni,1
berdoa dulu kak beneran indo soalnya ireneseulgi indo diskip malah langsung malay aku ovt sengan sahnya ruu tni,0
pas demo palestina yo komen e do ngene kabeh drg ing icj mung do sambathujatan thok mulo pas demo tolak ruu tni ra digubris wong rakyat e dewe do egois ribut dewe,0
membahas ruu tni caca,1
ketua pbhi julius ibrani ruu polri tni kejaksaan berisiko memperburuk keadaan memberikan kewenangan berlebihan aparat penegak hukum mekanisme kontrol memadai,1
pengesahan ruu perubahan atas uu tni merupakan momentum penting memperkuat system pertahanan nasional adaptif profesional tni cekfakta uutni dukunguutni,1
mau ngapain mempermasalahkan ngurusin ijazah presiden sebelumnya mending ngurusin knp presiden skrg mengesahkan ruu tni,0
pantes demo tolak ruu tni gak didenger kan ruu udah sah udah jadi uu harusnya demo tolak uu tni mungkin mikirnya,0
ruu tni udah beneran mulai keliatan nih perangkat nya udah mulai masuk kampus,1
sepertinya ruu tni tekanan keselamatannya tinggi,0
mana ruu tni udah disahkan diem,1
penjemputan aspri menggunakan pesawat negara membanggakan pencopotan jabatan hadapan media asing pengesahan ruu tni penculikan aktivis food estate tetap kekeh wakil presiden merusak konstitusi apa coba beri tahu deh,1
ruu tni,1
list udah diberikan bowo tanam singkong tumbuh jagung membayar mbg miliar ihsg terjun bebas cmiiw tarif impor naik to rupiah dolar anjlok jadi rp ruu tni mengasihani koruptor mengasihani pejabat punya mobil,1
dukung ruu tni memperkuat sistem pertahanan negara uutni,1
dukung pengesahan ruu tni,1
ruu tni disahkan menyesuaikan ancaman masa kini,1
ruu tni memperkuat kontrol bukan membuka celah kekuasaan,1
bngst bisabisanya semalem abis mimpi prabowo pas wawancara keceplosan tujuan ruu tni buat ngelantik mami teddy jadi menhan,1
mengesahkan ruu tni berarti pemerintah sendiri,1
ruu tni meningkatkan keterlibatan tni penanganan bencana kegiatan kemanusiaan cekfakta uutni dukunguutni,1
dukung ruu tni rakyat bersama tni cekfakta uutni dukunguutni,1
ruu tni meningkatkan keterlibatan tni penanganan bencana kegiatan kemanusiaan cekfakta uutni dukunguutni,1
dukung ruu tni rakyat bersama tni cekfakta uutni dukunguutni,1
tolak ruu tni,0
mengesahkan ruu tni arus mudik dimulai dilakukan hari euforia timnasday vs bahrain murni kejahatan arogansi sengaja banget nunggu waktu mana rakyat lengah padahal gelombang protes udah jalan sejak awal maret tone deaf maksimal,0
harusnya trump singgung ruu tni ruu polri sama ormas,1
harusnya amerika singgung ruu tni ruu polri sama ormas,1
beer jangan ruu polri lolos ruu tni lolos disahkan kilat warga baik cinta demokrasi tolak ruu polri mengekang rakyat ruu tni ruu polri disahkan percaya hamas densus,1
rapat sembunyi maksudnya pengesahan ruu tni diam,0
kemarin aku cek berita kalau ruu tni sahkan kayak woy wowo lo liat dong banyak loh masyarakat akses pelayanan kesehatan baik sih lu malah yapping masalah ruu tni sama mbg,0
skrg jokowi prabowo kim menguasai dpr pdip apanya ruu perampasan aset dibahasmasuk prolegnas malah mensahkan uu tni kontroversial,1
temen aku diusir rumah gara gara bapaknya tni temen aku ikut demo tolak ruu tni,0
ruu tni baru bang penambahan pengawasan jd wajib pake kamera gitu baju polisinya eh salah baca ternyata ruu tni versi mimpi,0
gak mau ruu tni disahkan tau dekat naik biasa diperkerjakan luar tusi manut mending bikin uu remun kenaikan pangkat lebih adil uu tni lebih politis,0
laporan jauh lebih akurat terbuka transparan ketimbang draft ruu tni,1
uu tni disahkan ruu polro otw uu asn diacak cur ancur ancur ancur jahat banget jadi manusia semoga semua terlibat dibalik balasan dunia akhirat aamiin,0
banyak kok baiknya menculik aktivis memfitnah pendemo mendukung ruu tni kasih mbg bukan baik tolol baik kalo duit sendiri pake apbn turun pas banjir makaudnya gimmick biar keliatan kerja kan warga bekasi udah paham banyak twtnya gamuat,0
proses penyusunan ruu tni dianggap bermasalah transparan melibatkan partisipasi publik luas,1
ruu tni disahkan dikhawatirkan menimbulkan beberapa kerugian potensi melemahnya supremasi sipil peningkatan keterlibatan militer ranah sipil bahkan kembalinya dwifungsi abri masa orde baru,1
bagian sahkan ruu tni udah rugi makna implikasi revisi ruu tni berarti perluasan peran tni sektor sipil bertambahnya jumlah lembaga diisi prajurit tni aktif terjadi perluasan peran militer pemerintahan sipil,1
gak baca bang etapi tanda tangan ngesahin ruu tni,0
